{
  "conditions": [],
  "confidence": 0.25,
  "constraints": {
    "accessibility_and_inclusion": {
      "applicability": "required",
      "assessment": "not-assessed",
      "confidence": 0.25,
      "dimension_id": "accessibility-and-inclusion",
      "evidence": [
        {
          "description": "No accessibility or inclusion review evidence was supplied for the approved page.",
          "evidence_class": "grounded-judgment",
          "locator": "earlier independent results",
          "strength": "none"
        }
      ],
      "measures": [],
      "rationale": "Required constraint evidence was not provided."
    },
    "global_and_localization_readiness": {
      "applicability": "optional",
      "assessment": "not-assessed",
      "confidence": 0.25,
      "dimension_id": "global-and-localization-readiness",
      "evidence": [
        {
          "description": "No globalization or localization evidence was supplied, and nothing in the approved page established applicability beyond English-only local CLI examples.",
          "evidence_class": "grounded-judgment",
          "locator": "earlier independent results",
          "strength": "none"
        }
      ],
      "measures": [],
      "rationale": "No evidence supported assessment of localization readiness."
    },
    "human_agent_representation_parity": {
      "applicability": "required",
      "assessment": "not-assessed",
      "confidence": 0.25,
      "dimension_id": "human-agent-representation-parity",
      "evidence": [
        {
          "description": "No human or agent outcome baseline or verified attempts were available to compare representation parity.",
          "evidence_class": "outcome-evaluation",
          "locator": "test-audience-understanding summary",
          "strength": "none"
        }
      ],
      "measures": [],
      "rationale": "Required parity evidence was not provided."
    },
    "legal_policy_support": {
      "applicability": "required",
      "assessment": "not-assessed",
      "confidence": 0.25,
      "dimension_id": "legal-policy-support",
      "evidence": [
        {
          "description": "No legal, policy, or support compliance evidence was supplied for the reviewed page.",
          "evidence_class": "grounded-judgment",
          "locator": "earlier independent results",
          "strength": "none"
        }
      ],
      "measures": [],
      "rationale": "Required constraint evidence was not provided."
    },
    "safety_security_privacy": {
      "applicability": "required",
      "assessment": "not-assessed",
      "confidence": 0.25,
      "dimension_id": "safety-security-privacy",
      "evidence": [
        {
          "description": "No safety, security, or privacy review evidence was supplied for the reviewed page.",
          "evidence_class": "grounded-judgment",
          "locator": "earlier independent results",
          "strength": "none"
        }
      ],
      "measures": [],
      "rationale": "Required constraint evidence was not provided."
    }
  },
  "evaluated_at": "2026-09-23T00:00:00Z",
  "evaluation_id": "quality-eval-docs-quickstart-74ecf7d2",
  "evaluation_version": "1.0",
  "evaluator": {
    "independence_evidence": "Independent evaluation step using supplied frozen evidence only; no authoring context was used.",
    "independent_of_authors": true,
    "provider_id": "docsfab-agent",
    "provider_type": "agent"
  },
  "findings": [
    {
      "acceptance_condition": "Independently verify against the frozen source that the quickstart's default-name explanation and expected output match FACT-6 exactly, preserving the uncertainty text 'Observed from source only; default-path output was not executed.' in the verification record.",
      "description": "Open originating findings REV-001 and TECH-001 retain FACT-6 and its linked issue ID TECH-001: When no overriding flags are supplied, name defaults to friend and format defaults to text, producing Hello, friend! as the derived message in text mode. Uncertainty: Observed from source only; default-path output was not executed. The reviewed quickstart instead states the default name is world and predicts Hello, world!.",
      "dimension_id": "factual-accuracy",
      "evidence": [
        {
          "description": "Originating IDs REV-001, TECH-001, FACT-6. Source lines establish the default bindings and emitted text-mode message for the reviewed command path.",
          "evidence_class": "grounded-judgment",
          "locator": "docs/quickstart.md:11; src/sprout.mjs:12-13; src/sprout.mjs:19-20; src/sprout.mjs:26-27",
          "strength": "direct"
        }
      ],
      "id": "FIND-TECH-DEFAULT-OUTPUT",
      "owner": "documentation-owner",
      "severity": "major",
      "status": "open"
    },
    {
      "acceptance_condition": "Independently verify against the frozen source that the structured-output example and field description match FACT-2 exactly, preserving the uncertainty text 'Observed from source only; output forms were not executed.' in the verification record.",
      "description": "Open originating findings REV-002 and TECH-002 retain FACT-2 and its linked issue ID TECH-002: The --format value is accepted only as text or json and selects plain-text output versus a JSON stringified object with a message field. Uncertainty: Observed from source only; output forms were not executed. The reviewed quickstart instead documents a greeting property.",
      "dimension_id": "factual-accuracy",
      "evidence": [
        {
          "description": "Originating IDs REV-002, TECH-002, FACT-2. Source lines establish the accepted format values and emitted JSON object shape with the message field.",
          "evidence_class": "grounded-judgment",
          "locator": "docs/quickstart.md:19; src/sprout.mjs:22-27",
          "strength": "direct"
        }
      ],
      "id": "FIND-TECH-JSON-FIELD",
      "owner": "documentation-owner",
      "severity": "major",
      "status": "open"
    },
    {
      "acceptance_condition": "Independently verify that the reviewed quickstart or its explicitly approved dependency coverage accounts for each retained fact ID FACT-9 through FACT-15 with the exact linked issue ID TECH-003 and preserves each fact's uncertainty text in the verification record.",
      "description": "Open originating finding TECH-003 consolidates admitted non-documented facts FACT-9, FACT-10, FACT-11, FACT-12, FACT-13, FACT-14, and FACT-15 with linked issue ID TECH-003. FACT-10: Successful help and greeting results are written to standard output via console.log. Uncertainty: Observed from source only; stdout writes were not executed. FACT-9: Invalid command, malformed option usage, and unsupported format errors are written to standard error via console.error. Uncertainty: Observed from source only; stderr writes were not executed. FACT-11: If --format resolves to a value other than text or json, the CLI prints an unsupported-format error and exits with status code 2. Uncertainty: Observed from source only; unsupported-format branch was not executed. FACT-12: If a post-greet argument pair uses an unrecognized flag or omits the required value token, the CLI prints an error and exits with status code 2. Uncertainty: Observed from source only; malformed-option branch was not executed. FACT-13: If the first positional argument is not greet, the CLI prints an error and exits with status code 2. Uncertainty: Observed from source only; invalid-command branch was not executed. FACT-14: The help path exits with status code 0 after printing usage and defaults text. Uncertainty: Observed from source only; exit status was not executed. FACT-15: The implementation's help text declares that no network access or configuration files are required for this CLI usage path. Uncertainty: Observed from source only from help text and nearby implementation; the no-network and no-config-file path was not executed.",
      "dimension_id": "scoped-sufficiency",
      "evidence": [
        {
          "description": "Originating ID TECH-003 with retained fact IDs FACT-9, FACT-10, FACT-11, FACT-12, FACT-13, FACT-14, and FACT-15. These source ranges establish output channels, help behavior, prerequisite statement, and explicit error branches.",
          "evidence_class": "grounded-judgment",
          "locator": "src/sprout.mjs:27; src/sprout.mjs:4-5; src/sprout.mjs:16; src/sprout.mjs:23; src/sprout.mjs:22-24; src/sprout.mjs:14-17; src/sprout.mjs:8-10; src/sprout.mjs:3-6; src/sprout.mjs:5",
          "strength": "direct"
        },
        {
          "description": "The reviewed quickstart focuses on happy-path usage and defers broader option and error coverage to a linked guide that was outside the approved review set.",
          "evidence_class": "grounded-judgment",
          "locator": "docs/quickstart.md:3; docs/quickstart.md:21-22",
          "strength": "direct"
        }
      ],
      "id": "FIND-TECH-OMITTED-ERRORS-AND-IO",
      "owner": "documentation-owner",
      "severity": "major",
      "status": "open"
    },
    {
      "acceptance_condition": "Obtain approved governing authority before presenting FACT-16 as established runtime policy, and preserve the exact uncertainty text 'Observed from source only; runtime availability of node was not verified in an environment.' in any verification or dismissal rationale.",
      "description": "Open originating finding TECH-004 retains FACT-16 and linked issue ID TECH-004: The program is authored to run as a Node executable via a shebang that invokes env node. Uncertainty: Observed from source only; runtime availability of node was not verified in an environment. This remains source-observed but policy-unverified for documentation authority.",
      "dimension_id": "grounding-authority",
      "evidence": [
        {